Category,URL,Title
Ingles Practicas,https://www.youtube.com/watch?v=q-6HzRHhwBo&t=4587s,English Conversation Practice; Life Transitions
Tv en vivo,https://www.youtube.com/watch?v=ocFG3yor--M,LN+ EN VIVO | Últimas noticias de Argentina y el mundo
Tv en vivo,https://www.youtube.com/watch?v=cb12KmMMDJA,TN EN VIVO I SEGUÍ LA TRANSMISIÓN EN VIVO DE TODO NOTICIAS
Musica espiritual,https://youtu.be/1fDOsdEDQ1s?si=6bSKlkgJv8An7cRO,"Angelic Relaxing Frequency (1hr) - Sound Healing For Stress Release, Peaceful Sleep, Deep Meditation"
Meditación,https://www.youtube.com/watch?v=15tVFFGsI1E&t=9019s,777 Hz Third Eye Activation Meditation | Clarify & Awaken Your Inner Vision | Ambient Flute Music
Ingles Practicas,https://youtu.be/_KXmZKW_cag?si=K_DJCjC-4680qlGI,Learn English conversation-English comedy-English Speaking  Part 1
Ingles Practicas,https://youtu.be/Wl6GdXObW50?si=dIcm32V1CY39d80v,English Conversation 27 | Everyday English | Funny English
Musica Grunge,https://www.youtube.com/watch?v=ZYG3BPvFOgs,Alter Bridge - Rise Today
